{
  "$schema": "https://json-schema.org/draft/2020-12/schema",
  "type": "object",
  "additionalProperties": false,
  "required": [
    "schemaVersion",
    "approval",
    "workspaceRoots",
    "sourcePaths",
    "artifactPaths",
    "actions",
    "deniedPaths",
    "deniedActions",
    "prohibitedActions",
    "disclosure",
    "secrets",
    "deployment",
    "irreversibleActions",
    "network",
    "expiresAt",
    "budget"
  ],
  "properties": {
    "schemaVersion": {
      "const": 2
    },
    "approval": {
      "type": "object",
      "additionalProperties": false,
      "required": [
        "approvedBy",
        "evidenceId",
        "evidenceDigest"
      ],
      "properties": {
        "approvedBy": {
          "type": "string",
          "minLength": 1,
          "maxLength": 256,
          "x-minUtf8Bytes": 1,
          "x-maxUtf8Bytes": 256,
          "pattern": "^[A-Za-z0-9][A-Za-z0-9._:-]{0,255}$"
        },
        "evidenceId": {
          "type": "string",
          "minLength": 1,
          "maxLength": 256,
          "x-minUtf8Bytes": 1,
          "x-maxUtf8Bytes": 256,
          "pattern": "^[A-Za-z0-9][A-Za-z0-9._:-]{0,255}$"
        },
        "evidenceDigest": {
          "type": "string",
          "pattern": "^sha256:[a-f0-9]{64}$"
        }
      }
    },
    "workspaceRoots": {
      "type": "array",
      "items": {
        "oneOf": [
          {
            "const": "."
          },
          {
            "type": "string",
            "minLength": 1,
            "maxLength": 4096,
            "pattern": "^(?!/)(?![A-Za-z]:)(?!.*(?:^|/)\\.{1,2}(?:/|$))(?!.*[\\\\*?\\[\\]{}]).+$"
          }
        ]
      },
      "minItems": 1,
      "maxItems": 64,
      "uniqueItems": true
    },
    "sourcePaths": {
      "type": "array",
      "items": {
        "oneOf": [
          {
            "const": "."
          },
          {
            "type": "string",
            "minLength": 1,
            "maxLength": 4096,
            "pattern": "^(?!/)(?![A-Za-z]:)(?!.*(?:^|/)\\.{1,2}(?:/|$))(?!.*[\\\\*?\\[\\]{}]).+$"
          }
        ]
      },
      "minItems": 0,
      "maxItems": 256,
      "uniqueItems": true
    },
    "artifactPaths": {
      "type": "array",
      "items": {
        "oneOf": [
          {
            "const": "."
          },
          {
            "type": "string",
            "minLength": 1,
            "maxLength": 4096,
            "pattern": "^(?!/)(?![A-Za-z]:)(?!.*(?:^|/)\\.{1,2}(?:/|$))(?!.*[\\\\*?\\[\\]{}]).+$"
          }
        ]
      },
      "minItems": 0,
      "maxItems": 256,
      "uniqueItems": true
    },
    "actions": {
      "type": "array",
      "items": {
        "type": "string",
        "enum": [
          "fabric.v1.authority.delegate",
          "fabric.v1.agent.register",
          "fabric.v1.agent.spawn",
          "fabric.v1.agent.attach",
          "fabric.v1.message.send",
          "fabric.v1.discussion-group.create",
          "fabric.v1.message.receive",
          "fabric.v1.delivery.acknowledge",
          "fabric.v1.delivery.abandon",
          "fabric.v1.mailbox.read",
          "fabric.v1.task.create",
          "fabric.v1.task.claim",
          "fabric.v1.task.readiness.refresh",
          "fabric.v1.task.objective-check.record",
          "fabric.v1.task.handoff.acknowledge",
          "fabric.v1.task.read",
          "fabric.v1.task.update",
          "fabric.v1.task.owner-recovery-proof.record",
          "fabric.v1.task.owner.recover",
          "fabric.v1.lease.revocation-proof.record",
          "fabric.v1.capability.revoke",
          "fabric.v1.capability.rotate",
          "fabric.v1.write-lease.acquire",
          "fabric.v1.write-lease.recover",
          "fabric.v1.write-lease.renew",
          "fabric.v1.write-lease.read",
          "fabric.v1.write-lease.release",
          "fabric.v1.lifecycle.request",
          "fabric.v1.lifecycle.read",
          "fabric.v1.provider-state.report",
          "fabric.v1.provider-action.dispatch",
          "fabric.v1.provider-action.reconcile",
          "fabric.v1.provider-action.read",
          "fabric.v1.operator-intervention.record",
          "fabric.v1.visibility-failure.record",
          "fabric.v1.team.create",
          "fabric.v1.team.read",
          "fabric.v1.subtree.freeze",
          "fabric.v1.subtree.adopt",
          "fabric.v1.subtree-barrier.close",
          "fabric.v1.budget.reserve",
          "fabric.v1.budget.usage.record",
          "fabric.v1.budget.usage.reconcile",
          "fabric.v1.budget.release",
          "fabric.v1.budget.read",
          "fabric.v1.artifact.publish",
          "fabric.v1.barrier.close",
          "fabric.v1.run-status.read",
          "fabric.v1.events.observe",
          "fabric.v1.task.list",
          "fabric.v1.agent.list",
          "fabric.v1.receipt.list",
          "fabric.v1.receipt.export",
          "fabric.v1.project-session.membership.bind",
          "fabric.v1.intake.revise",
          "fabric.v1.scoped-gate.create",
          "fabric.v1.scoped-gate.check",
          "fabric.v1.resource.reserve",
          "fabric.v1.resource.release",
          "fabric.v1.resource.reconcile",
          "fabric.v1.task.request",
          "fabric.v1.task.complete-with-reply",
          "fabric.v1.result-delivery.claim",
          "fabric.v1.result-delivery.consume",
          "fabric.v1.result-delivery.retry",
          "fabric.v1.result-delivery.reassign",
          "fabric.v1.result-delivery.abandon",
          "fabric.v1.workstream.create",
          "fabric.v1.workstream.settle",
          "fabric.v1.evidence.publish",
          "fabric.v1.review-target.prepare",
          "fabric.v1.review-target-preparation.read",
          "fabric.v1.review-target.rebind",
          "fabric.v1.review-evidence.read",
          "fabric.v1.review-evidence.list",
          "fabric.v1.review-evidence.annotate",
          "fabric.v1.review-evidence-annotation.current.read",
          "fabric.v1.review-finding-page.read",
          "fabric.v1.review-completion.read",
          "fabric.v1.provider-route-integrity-recovery.read",
          "fabric.v1.provider-context-pressure.read",
          "fabric.v1.herdr-steer.dispatch",
          "fabric.v1.topology-wave.append",
          "fabric.v1.topology-wave.current.read",
          "fabric.v1.topology-wave.list"
        ]
      },
      "minItems": 0,
      "maxItems": 256,
      "uniqueItems": true
    },
    "deniedPaths": {
      "type": "array",
      "items": {
        "oneOf": [
          {
            "const": "."
          },
          {
            "type": "string",
            "minLength": 1,
            "maxLength": 4096,
            "pattern": "^(?!/)(?![A-Za-z]:)(?!.*(?:^|/)\\.{1,2}(?:/|$))(?!.*[\\\\*?\\[\\]{}]).+$"
          }
        ]
      },
      "minItems": 0,
      "maxItems": 256,
      "uniqueItems": true
    },
    "deniedActions": {
      "type": "array",
      "items": {
        "type": "string",
        "enum": [
          "fabric.v1.authority.delegate",
          "fabric.v1.agent.register",
          "fabric.v1.agent.spawn",
          "fabric.v1.agent.attach",
          "fabric.v1.message.send",
          "fabric.v1.discussion-group.create",
          "fabric.v1.message.receive",
          "fabric.v1.delivery.acknowledge",
          "fabric.v1.delivery.abandon",
          "fabric.v1.mailbox.read",
          "fabric.v1.task.create",
          "fabric.v1.task.claim",
          "fabric.v1.task.readiness.refresh",
          "fabric.v1.task.objective-check.record",
          "fabric.v1.task.handoff.acknowledge",
          "fabric.v1.task.read",
          "fabric.v1.task.update",
          "fabric.v1.task.owner-recovery-proof.record",
          "fabric.v1.task.owner.recover",
          "fabric.v1.lease.revocation-proof.record",
          "fabric.v1.capability.revoke",
          "fabric.v1.capability.rotate",
          "fabric.v1.write-lease.acquire",
          "fabric.v1.write-lease.recover",
          "fabric.v1.write-lease.renew",
          "fabric.v1.write-lease.read",
          "fabric.v1.write-lease.release",
          "fabric.v1.lifecycle.request",
          "fabric.v1.lifecycle.read",
          "fabric.v1.provider-state.report",
          "fabric.v1.provider-action.dispatch",
          "fabric.v1.provider-action.reconcile",
          "fabric.v1.provider-action.read",
          "fabric.v1.operator-intervention.record",
          "fabric.v1.visibility-failure.record",
          "fabric.v1.team.create",
          "fabric.v1.team.read",
          "fabric.v1.subtree.freeze",
          "fabric.v1.subtree.adopt",
          "fabric.v1.subtree-barrier.close",
          "fabric.v1.budget.reserve",
          "fabric.v1.budget.usage.record",
          "fabric.v1.budget.usage.reconcile",
          "fabric.v1.budget.release",
          "fabric.v1.budget.read",
          "fabric.v1.artifact.publish",
          "fabric.v1.barrier.close",
          "fabric.v1.run-status.read",
          "fabric.v1.events.observe",
          "fabric.v1.task.list",
          "fabric.v1.agent.list",
          "fabric.v1.receipt.list",
          "fabric.v1.receipt.export",
          "fabric.v1.project-session.membership.bind",
          "fabric.v1.intake.revise",
          "fabric.v1.scoped-gate.create",
          "fabric.v1.scoped-gate.check",
          "fabric.v1.resource.reserve",
          "fabric.v1.resource.release",
          "fabric.v1.resource.reconcile",
          "fabric.v1.task.request",
          "fabric.v1.task.complete-with-reply",
          "fabric.v1.result-delivery.claim",
          "fabric.v1.result-delivery.consume",
          "fabric.v1.result-delivery.retry",
          "fabric.v1.result-delivery.reassign",
          "fabric.v1.result-delivery.abandon",
          "fabric.v1.workstream.create",
          "fabric.v1.workstream.settle",
          "fabric.v1.evidence.publish",
          "fabric.v1.review-target.prepare",
          "fabric.v1.review-target-preparation.read",
          "fabric.v1.review-target.rebind",
          "fabric.v1.review-evidence.read",
          "fabric.v1.review-evidence.list",
          "fabric.v1.review-evidence.annotate",
          "fabric.v1.review-evidence-annotation.current.read",
          "fabric.v1.review-finding-page.read",
          "fabric.v1.review-completion.read",
          "fabric.v1.provider-route-integrity-recovery.read",
          "fabric.v1.provider-context-pressure.read",
          "fabric.v1.herdr-steer.dispatch",
          "fabric.v1.topology-wave.append",
          "fabric.v1.topology-wave.current.read",
          "fabric.v1.topology-wave.list"
        ]
      },
      "minItems": 0,
      "maxItems": 256,
      "uniqueItems": true
    },
    "prohibitedActions": {
      "type": "array",
      "items": {
        "type": "string",
        "minLength": 1,
        "maxLength": 256,
        "x-minUtf8Bytes": 1,
        "x-maxUtf8Bytes": 256,
        "pattern": "^[A-Za-z0-9][A-Za-z0-9._:-]{0,255}$"
      },
      "minItems": 0,
      "maxItems": 256,
      "uniqueItems": true
    },
    "disclosure": {
      "oneOf": [
        {
          "type": "object",
          "additionalProperties": false,
          "required": [
            "level"
          ],
          "properties": {
            "level": {
              "const": "allowed"
            }
          }
        },
        {
          "type": "object",
          "additionalProperties": false,
          "required": [
            "level",
            "scopes"
          ],
          "properties": {
            "level": {
              "const": "scoped"
            },
            "scopes": {
              "type": "array",
              "items": {
                "type": "string",
                "enum": [
                  "local",
                  "approved-provider",
                  "external"
                ]
              },
              "minItems": 1,
              "maxItems": 2,
              "uniqueItems": true
            }
          }
        },
        {
          "type": "object",
          "additionalProperties": false,
          "required": [
            "level"
          ],
          "properties": {
            "level": {
              "const": "forbidden"
            }
          }
        }
      ]
    },
    "secrets": {
      "oneOf": [
        {
          "type": "object",
          "additionalProperties": false,
          "required": [
            "access"
          ],
          "properties": {
            "access": {
              "const": "none"
            }
          }
        },
        {
          "type": "object",
          "additionalProperties": false,
          "required": [
            "access",
            "references"
          ],
          "properties": {
            "access": {
              "const": "use-without-disclosure"
            },
            "references": {
              "type": "array",
              "items": {
                "type": "string",
                "minLength": 1,
                "maxLength": 256,
                "x-minUtf8Bytes": 1,
                "x-maxUtf8Bytes": 256,
                "pattern": "^[A-Za-z0-9][A-Za-z0-9._:-]{0,255}$"
              },
              "minItems": 1,
              "maxItems": 256,
              "uniqueItems": true
            }
          }
        }
      ]
    },
    "deployment": {
      "oneOf": [
        {
          "type": "object",
          "additionalProperties": false,
          "required": [
            "allowed"
          ],
          "properties": {
            "allowed": {
              "const": false
            }
          }
        },
        {
          "type": "object",
          "additionalProperties": false,
          "required": [
            "allowed",
            "targets"
          ],
          "properties": {
            "allowed": {
              "const": true
            },
            "targets": {
              "type": "array",
              "items": {
                "type": "string",
                "minLength": 1,
                "maxLength": 256,
                "x-minUtf8Bytes": 1,
                "x-maxUtf8Bytes": 256,
                "pattern": "^[A-Za-z0-9][A-Za-z0-9._:-]{0,255}$"
              },
              "minItems": 1,
              "maxItems": 256,
              "uniqueItems": true
            }
          }
        }
      ]
    },
    "irreversibleActions": {
      "oneOf": [
        {
          "type": "object",
          "additionalProperties": false,
          "required": [
            "allowed"
          ],
          "properties": {
            "allowed": {
              "const": false
            }
          }
        },
        {
          "type": "object",
          "additionalProperties": false,
          "required": [
            "allowed",
            "actionIds"
          ],
          "properties": {
            "allowed": {
              "const": true
            },
            "actionIds": {
              "type": "array",
              "items": {
                "type": "string",
                "minLength": 1,
                "maxLength": 256,
                "x-minUtf8Bytes": 1,
                "x-maxUtf8Bytes": 256,
                "pattern": "^[A-Za-z0-9][A-Za-z0-9._:-]{0,255}$"
              },
              "minItems": 1,
              "maxItems": 256,
              "uniqueItems": true
            }
          }
        }
      ]
    },
    "network": {
      "oneOf": [
        {
          "type": "object",
          "additionalProperties": false,
          "required": [
            "toolEgress"
          ],
          "properties": {
            "toolEgress": {
              "const": "none"
            }
          }
        },
        {
          "type": "object",
          "additionalProperties": false,
          "required": [
            "toolEgress",
            "allowedHosts"
          ],
          "properties": {
            "toolEgress": {
              "const": "allowlist"
            },
            "allowedHosts": {
              "type": "array",
              "items": {
                "type": "string",
                "minLength": 1,
                "maxLength": 253,
                "x-minUtf8Bytes": 1,
                "x-maxUtf8Bytes": 253,
                "pattern": "^[A-Za-z0-9][A-Za-z0-9.:-]{0,252}$"
              },
              "minItems": 1,
              "maxItems": 256,
              "uniqueItems": true
            }
          }
        }
      ]
    },
    "expiresAt": {
      "type": "string",
      "format": "date-time"
    },
    "budget": {
      "type": "object",
      "minProperties": 0,
      "maxProperties": 128,
      "propertyNames": {
        "oneOf": [
          {
            "type": "string",
            "enum": [
              "turns",
              "provider_calls",
              "concurrent_turns",
              "descendants",
              "message_bytes",
              "artifact_bytes",
              "wall_clock_milliseconds"
            ]
          },
          {
            "type": "string",
            "pattern": "^cost:(?:AED|AFN|ALL|AMD|ANG|AOA|ARS|AUD|AWG|AZN|BAM|BBD|BDT|BGN|BHD|BIF|BMD|BND|BOB|BRL|BSD|BTN|BWP|BYN|BZD|CAD|CDF|CHF|CLP|CNY|COP|CRC|CUC|CUP|CVE|CZK|DJF|DKK|DOP|DZD|EGP|ERN|ETB|EUR|FJD|FKP|GBP|GEL|GHS|GIP|GMD|GNF|GTQ|GYD|HKD|HNL|HRK|HTG|HUF|IDR|ILS|INR|IQD|IRR|ISK|JMD|JOD|JPY|KES|KGS|KHR|KMF|KPW|KRW|KWD|KYD|KZT|LAK|LBP|LKR|LRD|LSL|LYD|MAD|MDL|MGA|MKD|MMK|MNT|MOP|MRU|MUR|MVR|MWK|MXN|MYR|MZN|NAD|NGN|NIO|NOK|NPR|NZD|OMR|PAB|PEN|PGK|PHP|PKR|PLN|PYG|QAR|RON|RSD|RUB|RWF|SAR|SBD|SCR|SDG|SEK|SGD|SHP|SLE|SLL|SOS|SRD|SSP|STN|SVC|SYP|SZL|THB|TJS|TMT|TND|TOP|TRY|TTD|TWD|TZS|UAH|UGX|USD|UYU|UZS|VES|VND|VUV|WST|XAF|XCD|XCG|XDR|XOF|XPF|XSU|YER|ZAR|ZMW|ZWG|ZWL)$"
          },
          {
            "type": "string",
            "pattern": "^(?:input_tokens|output_tokens):[a-z0-9]+(?:[.-][a-z0-9]+)*$"
          }
        ]
      },
      "additionalProperties": {
        "type": "integer",
        "minimum": 0,
        "maximum": 9007199254740991
      }
    }
  },
  "$defs": {
    "boundedJsonValue": {
      "x-boundedJson": true,
      "$ref": "#/$defs/jsonValueNode"
    },
    "jsonValueNode": {
      "oneOf": [
        {
          "type": "null"
        },
        {
          "type": "boolean"
        },
        {
          "type": "number"
        },
        {
          "type": "string",
          "maxLength": 1048576,
          "x-maxUtf8Bytes": 1048576
        },
        {
          "type": "array",
          "maxItems": 256,
          "items": {
            "$ref": "#/$defs/jsonValueNode"
          }
        },
        {
          "type": "object",
          "maxProperties": 256,
          "propertyNames": {
            "maxLength": 256,
            "x-maxUtf8Bytes": 256
          },
          "additionalProperties": {
            "$ref": "#/$defs/jsonValueNode"
          }
        }
      ]
    }
  }
}
