{
  "schemaVersion": 2,
  "approval": {
    "approvedBy": "human-maintainer",
    "evidenceId": "authority-approval",
    "evidenceDigest": "sha256:aaaaaaaaaaaaaaaaaaaaaaaaaaaaaaaaaaaaaaaaaaaaaaaaaaaaaaaaaaaaaaaa"
  },
  "workspaceRoots": ["."],
  "sourcePaths": ["input", "shared/read-only"],
  "artifactPaths": ["output"],
  "actions": [
    "fabric.v1.artifact.publish",
    "fabric.v1.task.read"
  ],
  "deniedPaths": [".git"],
  "deniedActions": ["fabric.v1.write-lease.acquire"],
  "prohibitedActions": ["external-release"],
  "disclosure": {
    "level": "scoped",
    "scopes": ["approved-provider", "local"]
  },
  "secrets": {
    "access": "use-without-disclosure",
    "references": ["provider-api-token"]
  },
  "deployment": {
    "allowed": true,
    "targets": ["staging"]
  },
  "irreversibleActions": {
    "allowed": true,
    "actionIds": ["schema-cutover"]
  },
  "network": {
    "toolEgress": "allowlist",
    "allowedHosts": ["api.example.test"]
  },
  "expiresAt": "2026-07-20T00:00:00Z",
  "budget": {
    "provider_calls": 2,
    "turns": 4
  }
}
